<?xml version="1.0" encoding="UTF-8"?>
<contacts
    xmlns:xsi='http://www.w3.org/2001/XMLSchema-instance'
    xsi:noNamespaceSchemaLocation='contacts.xsd'>
    <contact personID="P001">
        <name>
            <first>Saw</first>
            <first>Khoo</first>
            <middle>Zi</middle>
            <last>Chong</last>
        </name>
        <phone kind="Home">0351457895</phone>
        <knows contact="P002 P003"/>
    </contact>
    <contact personID="P002">
        <name>
            <first>Sim</first>
            <middle>Hor</middle>
            <last>Kang</last>
        </name>
        <phone kind="Cell">0115479633</phone>
        <knows contact="P001 P003"/>
    </contact>
    <contact personID="P003">
        <name>
            <first>Christopher Yap</first>
            <last>Jian Xing</last>
        </name>
        <phone kind="Cell">0157489588</phone>
        <knows contact="P001 P002"/>
    </contact>
</contacts>